{
  "$schema": "./registry.schema.json",
  "schema_version": 1,
  "registry_id": "hy-home.k8s/agents",
  "providers": [
    {
      "id": "claude",
      "gateway": "CLAUDE.md",
      "projection_root": ".claude/agents",
      "capability_models": {
        "top": "opus",
        "worker": "sonnet"
      },
      "capability_reasoning": {
        "top": "xhigh",
        "worker": "high"
      },
      "permission_scopes": {
        "read-only-evidence": [
          "Read",
          "Grep",
          "Glob",
          "Bash"
        ],
        "read-only-research": [
          "Read",
          "Grep",
          "Glob",
          "Bash",
          "WebFetch",
          "WebSearch"
        ],
        "scoped-authoring": [
          "Read",
          "Write",
          "Edit",
          "Grep",
          "Glob",
          "Bash"
        ],
        "orchestration": [
          "Read",
          "Grep",
          "Glob",
          "Bash",
          "Task"
        ]
      }
    },
    {
      "id": "codex",
      "gateway": "AGENTS.md",
      "projection_root": ".codex/agents",
      "capability_models": {
        "top": "gpt-6-sol",
        "worker": "gpt-6-sol"
      },
      "permission_scopes": {
        "read-only-evidence": "read-only",
        "read-only-research": "read-only",
        "orchestration": "read-only",
        "scoped-authoring": "workspace-write"
      },
      "capability_reasoning": {
        "top": "xhigh",
        "worker": "high"
      }
    }
  ],
  "permission_classes": [
    {
      "id": "read-only-evidence",
      "allows_mutation": false,
      "allows_delegation": false,
      "external_writes_require_approval": true
    },
    {
      "id": "read-only-research",
      "allows_mutation": false,
      "allows_delegation": false,
      "external_writes_require_approval": true
    },
    {
      "id": "scoped-authoring",
      "allows_mutation": true,
      "allows_delegation": false,
      "external_writes_require_approval": true
    },
    {
      "id": "orchestration",
      "allows_mutation": false,
      "allows_delegation": true,
      "external_writes_require_approval": true
    }
  ],
  "skills": [
    {
      "id": "archive-cutover",
      "path": ".agents/skills/archive-cutover/SKILL.md"
    },
    {
      "id": "deployment-strategies",
      "path": ".agents/skills/deployment-strategies/SKILL.md"
    },
    {
      "id": "docs-stage-conformance",
      "path": ".agents/skills/docs-stage-conformance/SKILL.md"
    },
    {
      "id": "docs-stage-routing",
      "path": ".agents/skills/docs-stage-routing/SKILL.md"
    },
    {
      "id": "execution-plan",
      "path": ".agents/skills/execution-plan/SKILL.md"
    },
    {
      "id": "gitops-workflow",
      "path": ".agents/skills/gitops-workflow/SKILL.md"
    },
    {
      "id": "incident-postmortem",
      "path": ".agents/skills/incident-postmortem/SKILL.md"
    },
    {
      "id": "k8s-security-audit",
      "path": ".agents/skills/k8s-security-audit/SKILL.md"
    },
    {
      "id": "k8s-validate",
      "path": ".agents/skills/k8s-validate/SKILL.md"
    },
    {
      "id": "knowledge-map",
      "path": ".agents/skills/knowledge-map/SKILL.md"
    },
    {
      "id": "ops-runbook",
      "path": ".agents/skills/ops-runbook/SKILL.md"
    },
    {
      "id": "rca-methodology",
      "path": ".agents/skills/rca-methodology/SKILL.md"
    },
    {
      "id": "requirements-to-design",
      "path": ".agents/skills/requirements-to-design/SKILL.md"
    },
    {
      "id": "risk-report",
      "path": ".agents/skills/risk-report/SKILL.md"
    },
    {
      "id": "task-breakdown",
      "path": ".agents/skills/task-breakdown/SKILL.md"
    },
    {
      "id": "vulnerability-patterns",
      "path": ".agents/skills/vulnerability-patterns/SKILL.md"
    },
    {
      "id": "workspace-harness-audit",
      "path": ".agents/skills/workspace-harness-audit/SKILL.md"
    }
  ],
  "roles": [
    {
      "id": "supervisor",
      "responsibility": "Route bounded work, preserve approval and ownership boundaries, and reconcile final evidence.",
      "permission_class": "orchestration",
      "capability_tier_ref": ".agents/governance/model-selection.md#top",
      "supported_providers": [
        "claude",
        "codex"
      ],
      "skill_refs": [
        "execution-plan",
        "risk-report",
        "task-breakdown"
      ],
      "handoff_to": [
        "agent-evaluator",
        "architect",
        "ci-workflow-engineer",
        "code-reviewer",
        "doc-writer",
        "docs-researcher",
        "gitops-reviewer",
        "governance-steward",
        "incident-responder",
        "k8s-implementer",
        "network-reviewer",
        "observability-reviewer",
        "quality-engineer",
        "repo-tooling-engineer",
        "security-auditor",
        "wiki-curator"
      ],
      "projections": {
        "neutral": ".agents/roles/supervisor.md",
        "claude": ".claude/agents/supervisor.md",
        "codex": ".codex/agents/supervisor.toml"
      },
      "native_model_override": {
        "codex": "gpt-6-astra",
        "claude": "fable"
      }
    },
    {
      "id": "code-reviewer",
      "responsibility": "Review repository changes for correctness, maintainability, regression risk, and policy alignment.",
      "permission_class": "read-only-evidence",
      "capability_tier_ref": ".agents/governance/model-selection.md#worker",
      "supported_providers": [
        "claude",
        "codex"
      ],
      "skill_refs": [
        "risk-report"
      ],
      "handoff_to": [
        "security-auditor",
        "supervisor"
      ],
      "projections": {
        "neutral": ".agents/roles/code-reviewer.md",
        "claude": ".claude/agents/code-reviewer.md",
        "codex": ".codex/agents/code-reviewer.toml"
      }
    },
    {
      "id": "doc-writer",
      "responsibility": "Author governed documentation at the canonical SDLC or common-document owner.",
      "permission_class": "scoped-authoring",
      "capability_tier_ref": ".agents/governance/model-selection.md#worker",
      "supported_providers": [
        "claude",
        "codex"
      ],
      "skill_refs": [
        "archive-cutover",
        "docs-stage-conformance",
        "docs-stage-routing",
        "requirements-to-design"
      ],
      "handoff_to": [
        "architect",
        "docs-researcher",
        "supervisor",
        "wiki-curator"
      ],
      "projections": {
        "neutral": ".agents/roles/doc-writer.md",
        "claude": ".claude/agents/doc-writer.md",
        "codex": ".codex/agents/doc-writer.toml"
      },
      "native_reasoning_override": {
        "codex": "medium",
        "claude": "medium"
      }
    },
    {
      "id": "gitops-reviewer",
      "responsibility": "Review GitOps manifests and reconciliation behavior without assuming mutation authority.",
      "permission_class": "read-only-evidence",
      "capability_tier_ref": ".agents/governance/model-selection.md#worker",
      "supported_providers": [
        "claude",
        "codex"
      ],
      "skill_refs": [
        "gitops-workflow",
        "k8s-validate"
      ],
      "handoff_to": [
        "k8s-implementer",
        "security-auditor",
        "supervisor"
      ],
      "projections": {
        "neutral": ".agents/roles/gitops-reviewer.md",
        "claude": ".claude/agents/gitops-reviewer.md",
        "codex": ".codex/agents/gitops-reviewer.toml"
      }
    },
    {
      "id": "incident-responder",
      "responsibility": "Triage incidents, bound impact, and produce evidence-based response and corrective-action guidance.",
      "permission_class": "read-only-evidence",
      "capability_tier_ref": ".agents/governance/model-selection.md#top",
      "supported_providers": [
        "claude",
        "codex"
      ],
      "skill_refs": [
        "incident-postmortem",
        "rca-methodology"
      ],
      "handoff_to": [
        "security-auditor",
        "k8s-implementer",
        "supervisor"
      ],
      "projections": {
        "neutral": ".agents/roles/incident-responder.md",
        "claude": ".claude/agents/incident-responder.md",
        "codex": ".codex/agents/incident-responder.toml"
      },
      "native_reasoning_override": {
        "codex": "high",
        "claude": "high"
      }
    },
    {
      "id": "k8s-implementer",
      "responsibility": "Implement explicitly scoped Kubernetes and GitOps changes and validate the affected reconciliation surface.",
      "permission_class": "scoped-authoring",
      "capability_tier_ref": ".agents/governance/model-selection.md#worker",
      "supported_providers": [
        "claude",
        "codex"
      ],
      "skill_refs": [
        "deployment-strategies",
        "gitops-workflow",
        "k8s-validate"
      ],
      "handoff_to": [
        "gitops-reviewer",
        "security-auditor",
        "supervisor"
      ],
      "projections": {
        "neutral": ".agents/roles/k8s-implementer.md",
        "claude": ".claude/agents/k8s-implementer.md",
        "codex": ".codex/agents/k8s-implementer.toml"
      }
    },
    {
      "id": "network-reviewer",
      "responsibility": "Review cluster networking, ingress, DNS, policy, and isolation behavior from repository evidence.",
      "permission_class": "read-only-evidence",
      "capability_tier_ref": ".agents/governance/model-selection.md#worker",
      "supported_providers": [
        "claude",
        "codex"
      ],
      "skill_refs": [
        "k8s-security-audit",
        "risk-report"
      ],
      "handoff_to": [
        "security-auditor",
        "gitops-reviewer",
        "supervisor"
      ],
      "projections": {
        "neutral": ".agents/roles/network-reviewer.md",
        "claude": ".claude/agents/network-reviewer.md",
        "codex": ".codex/agents/network-reviewer.toml"
      }
    },
    {
      "id": "observability-reviewer",